<?xml version="1.0"  encoding="ISO-8859-1" ?>
<!--
Automatically created by TimePetriNet StateSpaceExplorer
-->
<!DOCTYPE Grafo SYSTEM "TPN_graph.dtd">
<?xml-stylesheet type="text/xsl" href="TPN_graph.xsl"?>
<Grafo name="anonymous" level="1" state="101">
<not_explored_state>
</not_explored_state>
 <class level="0" id="0" >
   <place id="8" name="mem" tokens="1"/>
   <transx id="0" name="t0" Progr="Yes" New="Yes" EFT="  10" LFT="  10" Fir="Yes" class_dest="1"/>
   <transx id="10" name="t8" Progr="Yes" New="Yes" EFT="  20" LFT="  20" Fir="No "/>
   <transx id="14" name="t4" Progr="Yes" New="Yes" EFT="  10" LFT="  10" Fir="Yes" class_dest="2"/>
 </class>
 <class level="0" id="1" >
   <place id="0" name="p0" tokens="1"/>
   <place id="8" name="mem" tokens="1"/>
   <transx id="10" name="t8" Progr="Yes" New="No " EFT="  10" LFT="  10" Fir="No "/>
   <transx id="14" name="t4" Progr="Yes" New="No " EFT="   0" LFT="   0" Fir="Yes" class_dest="3"/>
   <transx id="9" name="t1" Progr="Yes" New="Yes" EFT="   0" LFT="   0" Fir="Yes" class_dest="4"/>
   <transx id="0" name="t0" Progr="Yes" New="Yes" EFT="  10" LFT="  10" Fir="No "/>
 </class>
 <class level="0" id="2" >
   <place id="5" name="p4" tokens="1"/>
   <place id="8" name="mem" tokens="1"/>
   <transx id="0" name="t0" Progr="Yes" New="No " EFT="   0" LFT="   0" Fir="Yes" class_dest="5"/>
   <transx id="10" name="t8" Progr="Yes" New="No " EFT="  10" LFT="  10" Fir="No "/>
   <transx id="5" name="t5" Progr="Yes" New="Yes" EFT="   0" LFT="   0" Fir="Yes" class_dest="6"/>
   <transx id="14" name="t4" Progr="Yes" New="Yes" EFT="  10" LFT="  10" Fir="No "/>
 </class>
 <class level="0" id="3" >
   <place id="0" name="p0" tokens="1"/>
   <place id="5" name="p4" tokens="1"/>
   <place id="8" name="mem" tokens="1"/>
   <transx id="9" name="t1" Progr="Yes" New="No " EFT="   0" LFT="   0" Fir="Yes" class_dest="7"/>
   <transx id="0" name="t0" Progr="Yes" New="No " EFT="  10" LFT="  10" Fir="No "/>
   <transx id="10" name="t8" Progr="Yes" New="No " EFT="  10" LFT="  10" Fir="No "/>
   <transx id="14" name="t4" Progr="Yes" New="Yes" EFT="  10" LFT="  10" Fir="No "/>
   <transx id="5" name="t5" Progr="No " New="Yes" EFT="   0" LFT="   0" Fir="No "/>
 </class>
 <class level="0" id="4" >
   <place id="4" name="p1" tokens="1"/>
   <place id="8" name="mem" tokens="1"/>
   <transx id="0" name="t0" Progr="Yes" New="No " EFT="  10" LFT="  10" Fir="No "/>
   <transx id="10" name="t8" Progr="Yes" New="No " EFT="  10" LFT="  10" Fir="No "/>
   <transx id="14" name="t4" Progr="Yes" New="No " EFT="   0" LFT="   0" Fir="Yes" class_dest="8"/>
   <transx id="1" name="t2" Progr="Yes" New="Yes" EFT="   0" LFT="   0" Fir="Yes" class_dest="9"/>
 </class>
 <class level="0" id="5" >
   <place id="0" name="p0" tokens="1"/>
   <place id="5" name="p4" tokens="1"/>
   <place id="8" name="mem" tokens="1"/>
   <transx id="10" name="t8" Progr="Yes" New="No " EFT="  10" LFT="  10" Fir="No "/>
   <transx id="14" name="t4" Progr="Yes" New="No " EFT="  10" LFT="  10" Fir="No "/>
   <transx id="9" name="t1" Progr="Yes" New="Yes" EFT="   0" LFT="   0" Fir="Yes" class_dest="7"/>
   <transx id="0" name="t0" Progr="Yes" New="Yes" EFT="  10" LFT="  10" Fir="No "/>
   <transx id="5" name="t5" Progr="No " New="No " EFT="   0" LFT="   0" Fir="No "/>
 </class>
 <class level="0" id="6" >
   <place id="6" name="p5" tokens="1"/>
   <place id="8" name="mem" tokens="1"/>
   <transx id="0" name="t0" Progr="Yes" New="No " EFT="   0" LFT="   0" Fir="Yes" class_dest="10"/>
   <transx id="10" name="t8" Progr="Yes" New="No " EFT="  10" LFT="  10" Fir="No "/>
   <transx id="14" name="t4" Progr="Yes" New="No " EFT="  10" LFT="  10" Fir="No "/>
   <transx id="6" name="t6" Progr="Yes" New="Yes" EFT="   0" LFT="   0" Fir="Yes" class_dest="11"/>
 </class>
 <class level="0" id="7" >
   <place id="5" name="p4" tokens="1"/>
   <place id="4" name="p1" tokens="1"/>
   <place id="8" name="mem" tokens="1"/>
   <transx id="0" name="t0" Progr="Yes" New="No " EFT="  10" LFT="  10" Fir="No "/>
   <transx id="10" name="t8" Progr="Yes" New="No " EFT="  10" LFT="  10" Fir="No "/>
   <transx id="14" name="t4" Progr="Yes" New="No " EFT="  10" LFT="  10" Fir="No "/>
   <transx id="1" name="t2" Progr="Yes" New="Yes" EFT="   0" LFT="   0" Fir="Yes" class_dest="12"/>
   <transx id="5" name="t5" Progr="No " New="No " EFT="   0" LFT="   0" Fir="No "/>
 </class>
 <class level="0" id="8" >
   <place id="5" name="p4" tokens="1"/>
   <place id="4" name="p1" tokens="1"/>
   <place id="8" name="mem" tokens="1"/>
   <transx id="1" name="t2" Progr="Yes" New="No " EFT="   0" LFT="   0" Fir="Yes" class_dest="12"/>
   <transx id="0" name="t0" Progr="Yes" New="No " EFT="  10" LFT="  10" Fir="No "/>
   <transx id="10" name="t8" Progr="Yes" New="No " EFT="  10" LFT="  10" Fir="No "/>
   <transx id="14" name="t4" Progr="Yes" New="Yes" EFT="  10" LFT="  10" Fir="No "/>
   <transx id="5" name="t5" Progr="No " New="Yes" EFT="   0" LFT="   0" Fir="No "/>
 </class>
 <class level="0" id="9" >
   <place id="10" name="p2" tokens="1"/>
   <transx id="0" name="t0" Progr="Yes" New="No " EFT="  10" LFT="  10" Fir="No "/>
   <transx id="10" name="t8" Progr="Yes" New="No " EFT="  10" LFT="  10" Fir="No "/>
   <transx id="14" name="t4" Progr="Yes" New="No " EFT="   0" LFT="   0" Fir="Yes" class_dest="13"/>
   <transx id="11" name="t3" Progr="Yes" New="Yes" EFT="   1" LFT="   2" Fir="No "/>
 </class>
 <class level="0" id="10" >
   <place id="0" name="p0" tokens="1"/>
   <place id="6" name="p5" tokens="1"/>
   <place id="8" name="mem" tokens="1"/>
   <transx id="10" name="t8" Progr="Yes" New="No " EFT="  10" LFT="  10" Fir="No "/>
   <transx id="14" name="t4" Progr="Yes" New="No " EFT="  10" LFT="  10" Fir="No "/>
   <transx id="9" name="t1" Progr="Yes" New="Yes" EFT="   0" LFT="   0" Fir="Yes" class_dest="14"/>
   <transx id="0" name="t0" Progr="Yes" New="Yes" EFT="  10" LFT="  10" Fir="No "/>
   <transx id="6" name="t6" Progr="No " New="No " EFT="   0" LFT="   0" Fir="No "/>
 </class>
 <class level="0" id="11" >
   <place id="7" name="p6" tokens="1"/>
   <transx id="0" name="t0" Progr="Yes" New="No " EFT="   0" LFT="   0" Fir="Yes" class_dest="15"/>
   <transx id="10" name="t8" Progr="Yes" New="No " EFT="  10" LFT="  10" Fir="No "/>
   <transx id="14" name="t4" Progr="Yes" New="No " EFT="  10" LFT="  10" Fir="No "/>
   <transx id="7" name="t7" Progr="Yes" New="Yes" EFT="   1" LFT="   2" Fir="No "/>
 </class>
 <class level="0" id="12" >
   <place id="5" name="p4" tokens="1"/>
   <place id="10" name="p2" tokens="1"/>
   <transx id="0" name="t0" Progr="Yes" New="No " EFT="  10" LFT="  10" Fir="No "/>
   <transx id="10" name="t8" Progr="Yes" New="No " EFT="  10" LFT="  10" Fir="No "/>
   <transx id="14" name="t4" Progr="Yes" New="No " EFT="  10" LFT="  10" Fir="No "/>
   <transx id="11" name="t3" Progr="Yes" New="Yes" EFT="   1" LFT="   2" Fir="Yes" class_dest="16"/>
   <transx id="5" name="t5" Progr="No " New="No " EFT="   0" LFT="   0" Fir="No "/>
 </class>
 <class level="0" id="13" >
   <place id="5" name="p4" tokens="1"/>
   <place id="10" name="p2" tokens="1"/>
   <transx id="11" name="t3" Progr="Yes" New="No " EFT="   1" LFT="   2" Fir="Yes" class_dest="16"/>
   <transx id="0" name="t0" Progr="Yes" New="No " EFT="  10" LFT="  10" Fir="No "/>
   <transx id="10" name="t8" Progr="Yes" New="No " EFT="  10" LFT="  10" Fir="No "/>
   <transx id="14" name="t4" Progr="Yes" New="Yes" EFT="  10" LFT="  10" Fir="No "/>
   <transx id="5" name="t5" Progr="No " New="Yes" EFT="   0" LFT="   0" Fir="No "/>
 </class>
 <class level="0" id="14" >
   <place id="6" name="p5" tokens="1"/>
   <place id="4" name="p1" tokens="1"/>
   <place id="8" name="mem" tokens="1"/>
   <transx id="0" name="t0" Progr="Yes" New="No " EFT="  10" LFT="  10" Fir="No "/>
   <transx id="10" name="t8" Progr="Yes" New="No " EFT="  10" LFT="  10" Fir="No "/>
   <transx id="14" name="t4" Progr="Yes" New="No " EFT="  10" LFT="  10" Fir="No "/>
   <transx id="1" name="t2" Progr="Yes" New="Yes" EFT="   0" LFT="   0" Fir="Yes" class_dest="17"/>
   <transx id="6" name="t6" Progr="No " New="No " EFT="   0" LFT="   0" Fir="No "/>
 </class>
 <class level="0" id="15" >
   <place id="0" name="p0" tokens="1"/>
   <place id="7" name="p6" tokens="1"/>
   <transx id="7" name="t7" Progr="Yes" New="No " EFT="   1" LFT="   2" Fir="Yes" class_dest="18"/>
   <transx id="10" name="t8" Progr="Yes" New="No " EFT="  10" LFT="  10" Fir="No "/>
   <transx id="14" name="t4" Progr="Yes" New="No " EFT="  10" LFT="  10" Fir="No "/>
   <transx id="0" name="t0" Progr="Yes" New="Yes" EFT="  10" LFT="  10" Fir="No "/>
   <transx id="9" name="t1" Progr="No " New="Yes" EFT="   0" LFT="   0" Fir="No "/>
 </class>
 <class level="0" id="16" >
   <place id="5" name="p4" tokens="1"/>
   <place id="8" name="mem" tokens="1"/>
   <transx id="5" name="t5" Progr="Yes" New="No " EFT="   0" LFT="   0" Fir="Yes" class_dest="19"/>
   <transx id="0" name="t0" Progr="Yes" New="No " EFT="   8" LFT="   9" Fir="No "/>
   <transx id="10" name="t8" Progr="Yes" New="No " EFT="   8" LFT="   9" Fir="No "/>
   <transx id="14" name="t4" Progr="Yes" New="No " EFT="   8" LFT="   9" Fir="No "/>
   <binding idtrans1="10" idtrans2="0" EFT="   0" LFT="   0"/>
   <binding idtrans1="14" idtrans2="0" EFT="   0" LFT="   0"/>
   <binding idtrans1="14" idtrans2="10" EFT="   0" LFT="   0"/>
 </class>
 <class level="0" id="17" >
   <place id="6" name="p5" tokens="1"/>
   <place id="10" name="p2" tokens="1"/>
   <transx id="0" name="t0" Progr="Yes" New="No " EFT="  10" LFT="  10" Fir="No "/>
   <transx id="10" name="t8" Progr="Yes" New="No " EFT="  10" LFT="  10" Fir="No "/>
   <transx id="14" name="t4" Progr="Yes" New="No " EFT="  10" LFT="  10" Fir="No "/>
   <transx id="11" name="t3" Progr="Yes" New="Yes" EFT="   1" LFT="   2" Fir="Yes" class_dest="19"/>
 </class>
 <class level="0" id="18" >
   <place id="0" name="p0" tokens="1"/>
   <place id="8" name="mem" tokens="1"/>